The Miracle of Life	Merce Parramon
The Rime of the Ancient Mariner	Samuel Taylor Coleridge
Don't Sleep, There Are Snakes	Daniel L. Everett
We, the Navigators	David Lewis
How Much Is Enough?	Robert Skidelsky
The Hockey Stick Illusion	Andrew Montford
What You Want	Constantine Phipps
Financial Derivatives	Jamil Baz
Good Calories, Bad Calories	Gary Taubes
How Nature Works: The Science of Self-Organized Criticality	Per Bak
Intellectuals in the Middle Ages	Jacques Le Goff
Kant and the Platypus	Umberto Eco
Mapping the Mind	Rita Carter
Mean Genes	Terry Burnham
Modern Aramaic-English/English-Modern Aramaic Dictionary & Phrasebook: Assyrian/Syriac	Nicholas Awde
No Bull	Michael Steinhardt
Probability, Random Variables, and Stochastic Processes	Athanasios Papoulis
Statistical Models	David Freeman
Straw Dogs	John Gray
The (Mis)behavior of Markets	Benoit Mandelbrot
The Discovery of France	Graham Robb
The Dream of Reason	Anthony Gottlieb
The Hour Between Dog & Wolf	John Coates
The Making of a Philosopher	Colin McGinn
The Mind Doesn't Work That Way	Jerry Fodor
The Science of Conjecture	James Franklin
The Status Syndrome	Michael Marmot
Thinking and Deciding	Jonathan Baron
Tyranny of Experts	William Easterly
Why Everyone (Else) Is a Hypocrite	Robert Kurzban
Gold and Iron	Fritz Stern
Demonstration Elections: United States Staged Elections in the Dominican Republic, Vietnam and El Salvador	Edward Herman
East Timor: The Price of Freedom	John G. Taylor
Economic Liberalism and Under-development	Frederick Clairmont
Emergence of a Free Press	Leonard W. Levy
European Empires from Conquest to Collapse, 1815-1960	V.G. Kiernan
Exporting Democracy: The United States and Latin America	Abraham F. Lowenthal
Expulsion of the Palestinians: The Concept of "Transfer" in Zionist Political Thought, 1882-1948	Nur Masalha
Facing West: Metaphysics of Indian-hating and Empire-building	Richard Drinnon
Field Notes on Democracy	Arundhati Roy
Granny Made Me an Anarchist	Stuart Christie
How America Gets Away with Murder	Michael Mandel
Human Rights and United States Policy Toward Latin America	Lars Schoultz
Image and Reality of the Israel-Palestine Conflict	Norman G. Finkelstein
In the Name of Democracy: U.S. Policy Toward Latin America in the Reagan Years	Thomas Carothers
Inevitable Revolutions: United States in Central America	Walter Lafeber
Intervention: How America Became Involved in Vietnam	George Kahin
Israel's Border Wars, 1949-1956: Arab Infiltration, Israeli Retaliation, and the Countdown to the Suez War	Benny Morris
John Quincy Adams and American Global Empire	William Earl Weeks
Just the Facts: A Civilian's Guide to U.S. Defense and Security Assistance to Latin America and the Caribbean	Joy Olson
Kennedy's Quest for Victory: American Foreign Policy, 1961-1963	Thomas G. Paterson
Killing Hope	William Blum
Last Reflections on a War: Bernard B.Fall's Last Comments on Vietnam	Bernard B. Fall
Nicaragua: The Price of Intervention : Reagan's Wars Against the Sandinistas	Peter Kornbluh
No Gods, No Masters: An Anthology of Anarchism	Daniel Guerin
Out of Control: The Story of the Reagan Administration's Secret War in Nicaragua, the Illegal Arms Pipeline, and the Contra Drug Connection	Leslie Cockburn
Panic Rules: Everything You Need to Know about the Global Economy	Robin Hahnel
Peace Denied: United States, Vietnam and the Paris Agreement	Gareth Porter
Politics of Health Policy: The U.S.Reforms, 1980-93	Vicente Navarro
Power Without Responsibility: Press, Broadcasting and the Internet in Britain	Jean Seaton
Qaddafi and the United States since 1969	Edward Haley
Reflections on the Cuban Missile Crisis	Raymond Garthoff
Requiem for Revolution: United States and Brazil, 1961-69	Ruth Leacock
Revolution and Civil War in Spain	Pierre Broue
Right Turn: The Decline of the Democrats and the Future of American Politics	Thomas Ferguson
Selling Free Enterprise: The Business Assault on Labor and Liberalism, 1945-60	Elizabeth Fones-Wolf
Spain and the Great Powers, 1936 to 1941	Dante Anthony Puzzo
Spanish Cockpit: An Eyewitness Account of the Spanish Civil War	Franz Borkenau
State Terrorism and the United States	Frederick Gareau
Supremacy and Oil: Iraq, Turkey and the Anglo-American World Order, 1918-30	William Stivers
Taking the Risk out of Democracy: Corporate Propaganda Versus Freedom and Liberty	Alex Carey
Talking to the Enemy	Scott Atran
The ABCs of Political Economy	Robin Hahnel
The Age of Terror: America and the World After September 11	Strobe Talbott
The Altenberg 16	Susan Mazur
The American Occupation of Japan: The Origins of the Cold War in Asia	Michael Schaller
The Anatomy of the Nuremberg Trials	Telford Taylor
The Birth of Israel	Simha Flapan
The CIA: Forgotten History	William Blum
The Crisis of Democracy	Samuel Huntington
The Deaths of Others	John Tirman
The Discovery of India	Jawaharlal Nehru
The Grand Camouflage: The Communist Conspiracy in the Spanish Civil War	Burnett Bolloten
The Great Transformation: The Political and Economic Origins of Our Time	Karl Polanyi
The Industrial Worker, 1840-1860	Norman Ware
The Iran-Contra Connection: Secret Teams and Covert Operations in the Reagan Era	Jane Hunter
The Kennedy Tapes. Inside the White House During the Cuban Missile Crisis	Ernest R. Ma
The Limits of State Action	Wilhelm von Humboldt
The Long Peace: Inquiries into the History of the Cold War	John Lewis Gaddis
The Making of the Arab-Israeli Conflict, 1947-1951	Ilan Pappe
The Marshall Plan: America, Britain and the Reconstruction of Western Europe, 1947-1952	Michael J. Hogan
The New Intifada: Resisting Israel's Apartheid	Roane Carey
The Origins of the Korean War: Volume II The Roaring of the Cataract 1947-1950	Bruce Cumings
The Price of Power: Kissinger in the Nixon White House	Seymour M. Hersh
The Punishment of Gaza	Gideon Levy
The Quality of Mercy: Cambodia, Holocaust and Modern Conscience	William Shawcross
The Reagan Aministration And Nicaragua	James Petras
The Real Terror Network: Terrorism in Fact and Propaganda	Edward Herman
The Rise and Fall of the Bulgarian Connection	Edward Herman
The Road to OPEC: United States Relations with Venezuela, 1919-1976	Stephen G. Rabe
The State of the World's Children: 1997	UNICEF
The Uncensored War: The Media and Vietnam	Daniel C. Hallin
The Uncensored War: The Media and Vietnam	Daniel Hallin
The United States and Fascist Italy, 1922-1940	David F. Schmitz
The United States and the Origins of the Cuban Revolution	Jules R Benjamin
The Uses of Haiti	Paul Farmer
The Verso Book of Dissent	Andrew Hsiao
U.S.Policy Toward Economic Nationalism in Latin America, 1917-29	Michael L. Krenn
Understanding Capitalism	Douglas Dowd
Viet Cong: The Organization and Techniques of the National Liberation Front of South Vietnam	Douglas Pike
War with Iraq: Costs, Consequences, and Alternatives	Carl Kaysen
Weakness and Deceit: America and El Salvador's Dirty War	Raymond Bonner
Web Of Deceit: Britain's Real Foreign Policy: Britain's Real Role in the World	Mark Curtis
Whose Crisis? Whose Future?	Susan George
Workers' Councils	Anton Pannekoek
Worlds in Collision	Ken Booth
The General Theory of Employment, Interest and Money	JM Keynes
Final Exit	Derek Humphrey
Humanity	Jonathan Glover
On Liberty	JS Mill
Pride & Prejudice	Jane Austen
Silent Spring	Rachel Carson
The Descent of Man	Charles Darwin
The Methods of Ethics	Henry Sidgwick
The Betrothed	Alessandro Manzoni
The Lord	Romano Guardini
The Story of a Soul	St Therese de Lisieux
Samarkand	Amin Maalouf
The Day the Leader Was Killed	Naguib Mahfouz
The Secret Life of Saeed the Pessoptimist	Emile Habiby 
Evolution of Cooperation	Robert Axelrod
Intuition Pumps and Other Tools for Thinking	Daniel Dennett
Red Strangers	Elspeth Huxley
Splendid Isolation	George Gaylord Simpson
The Ant and the Peacock	Helena Cronin
The Demon-Haunted World: Science as a Candle in the Dark	Carl Sagan
Uncle Fred in the Springtime	PG Wodehouse
Descartes Error	Antonio Damasio
Dialogues Concerning Natural Religion	David Hume
Discipline & Punish: The Birth of the Prison	Michel Foucault
Economy and Society	Max Weber
Eichmann in Jerusalem	Hannah Arendt
Ending Aging	Aubrey de Grey
Erwin Schrodinger and the Quantum Revolution 	John Gribbin
Essays in Radical Empiricism 	William James
Ethics	Baruch Spinoza
Ethics for the Real World	Ronald Howard
Eurabia	Ye'or Bat
Europe: A History	Norman Davies
Evilicious	Marc Hauser
Examined Lives	James Miller
Experiments in Ethics	Kwame Anthony Appiah
Extraordinary Popular Delusions and the Madness of Crowds	Charles Mackay
Eye for an Eye	William Ian Miller
Faith at War	Yaroslav Trofimov
Faking It	William Ian Miller
Food of the Gods	Terence McKenna
Free Will	Gary Watson
Freedom Evolves	Daniel Dennett
Fundamentals of Human Neuropsychology	Bryan Kolb
Game Change	John Heilemann
Genome	Matt Ridley
God: The Failed Hypothesis	Victor Stenger
Higher Superstition	Paul Gross
History of Christianity	Paul Johnson
Hitch-22	Christopher Hitchens
Honor	James Bowman
How the Mind Works	Steven Pinker
How We Die	Sherwin B. Nuland
Humanity	Jonathan Glover
Humiliation	William Ian Miller
I of the Vortex	Rodolfo R. Llinas
Ideas and Opinions	Albert Einstein
Imagined Worlds	Freeman Dyson
In Cold Blood	Truman Capote
Infidel	Ayaan Hirsi Ali
Into the Silent Land	Paul Broks
Isaac Newton	James Gleick
Jesus: A Life	AN Wilson
Joseph Anton: A Memoir	Salman Rushdie
Just Babies	Paul Bloom
Justice as Fairness	John Rawls
Kant: Ethical Philosophy: Grounding for the Metaphysics of Morals, and, Metaphysical Principles of Virtue, with, "On a Supposed Right to Lie Because of Philanthropic Concerns"	Immanuel Kant
King James Study Bible	Thomas Nelson
Kingdom Coming	Michelle Goldberg
Knowledge, Possibility, and Consciousness	John Perry
Labyrinths of Reason	William Poundstone
Letters From The Earth	Mark Twain
Letters to a Young Contrarian	Christopher Hitchens
Leviathan	Thomas Hobbes
Living High and Letting Die	Peter Unger
Looking for Spinoza	Antonio Damasio
Ludwig Wittgenstein	Ray Monk
Lying	Sissela Bok
Mapping the Mind	Rita Carter
Matter and Consciousness: A Contemporary Introduction to the Philosophy of Mind	Paul Churchland
Memory, Brain, and Belief	Daniel Schacter
Mind-Blindness	Simon Baron Cohen
Mindfulness in Plain English	Bhante Henepola Gunaratana
Mirroring People	Marco Iacoboni
Misquoting Jesus: The Story Behind Who Changed the Bible and Why	Bart Ehrman
Moral Minds	Marc Hauser
My Lunches with Orson	Henry Jaglom
My View of the World	Erwin Schrodinger
Natural Selection and Social Theory	Robert Trivers
Neural Correlates of Consciousness	Thomas Metzinger
Neuroethics	Neil Levy
Nomad	Ayaan Hirsi Ali
Omens of Millennium	Harold Bloom
On Being Certain	Robert Burton
On Certainty	Ludwig Wittgenstein
On Liberty	JS Mill
Open Secret	Wei Wei Wu Wei
Other Minds	Thomas Nagel
Our Final Hour	Martin Rees
Our Mathematical Universe	Max Tegmark
Out of My Later Years	Albert Einstein
Passage to Juneau	Jonathan Raban
Patterns of Culture	Ruth Benedict
Paul	AN Wilson
Perfect Soldiers	Terry McDermott
Persons And Places	George Santayana
Phantoms in the Brain	V. S. Ramachandran
Porphyry's Against the Christians	Porphyry
Predictably Irrational: The Hidden Forces that Shape Our Decisions	Dan Ariely
Principles of Neural Science	Eric Kandel
Quintessential Dzogchen	Tulku Urgyen Rinpoche
Religion and Science	Bertrand Russell
Religion Explained	Pascal Boyer
Righteous	Lauren Sandler
Scepticism And Animal Faith	George Santayana
Scientific Realism and the Plasticity of Mind	Paul Churchland
Second Nature: Brain Science and Human Knowledge	Gerald Edelman
Self-Contradictions of the Bible	William Burr
Self-Deception	Herbert Fingarette
Self-Deception Unmasked	Alfred Mele
Self-Liberation through Seeing with Naked Awareness	John Myrdhin Reynolds
Seven Pillars of Wisdom	TE Lawrence
Shankara's Crest Jewel of Discrimination	Swami Prabhavananda
Six Impossible Things Before Breakfast	Lewis Wolpert
Sleep Thieves	Stanley Coren
Storming Heaven: LSD and the American Dream	Jay Stevens
Stripping the Gurus	Geoffrey Falk
Stumbling on Happiness	Daniel Gilbert
Suicide	Emile Durkheim
Swami Prabhavananda	Niall Shanks
Synaptic Self	Joseph LeDoux
Terror and Liberalism	Paul Berman
The Abandonment of the Jews	David S. Wyman
The Anatomy of Disgust	William Ian Miller
The Anatomy of Evil	Michael Stone
The Anatomy of Melancholy	Robert Burton
The Aquariums of Pyongyang	Chol-hwan Kang
The Art Of War	Sun Tzu
The Awakening of Intelligence	Jiddu Krishnamurti
The Book of Dead Philosophers	Simon Critchley
The Book of J	Harold Bloom
The Cambridge Handbook of Thinking and Reasoning	Keith Holyoak
The Character of Physical Law	Richard Feynman
The Clash of Civilizations	Samuel Huntington
The Cleanest Race	BR Myers
The Construction of Social Reality 	John Searle
The Crisis of Islam	Bernard Lewis
The Day of the Barbarians	Alessandro Barbero
The Demon-Haunted World: Science as a Candle in the Dark	Carl Sagan
The Denial of Death	Ernest Becker
The Destructive Power of Religion	JH Ellens
The Diving Bell and the Butterfly	Jean-Dominique Bauby
The Doors of Perception and Heaven and Hell	Aldous Huxley
The Drowned and the Saved	Primo Levi
The Encyclopedia of Psychoactive Plants	Christian Ratsch
The End of Days	Gershom Gorenberg
The End of Illness	David Agus
The Engine of Reason	Paul Churchland
The Ethical Brain	Michael Gazzaniga
The Executive Brain	Elkhonon Goldberg
The Experience of Insight	Joseph Goldstein
The Fabric of the Cosmos: Space, Time, and the Texture of Reality	Brian Greene
The Feynman Lectures on Physics: The Definitive and Extended Edition	Richard Feynman
The Flight of the Garuda	Keith Dowman
The Future of an Illusion	Sigmund Freud
The Future of Freedom	Fareed Zakaria
The God Delusion	Richard Dawkins
The Gulag Archipelago	Aleksandr I. Solzhenitsyn
The Heart of Awareness: A Translation of the Ashtavakra Gita	Thomas Byrom
The Heart of Buddhist Meditation	Nyanaponika Thera
The Holocaust: A History of the Jews of Europe During the Second World War	Martin Gilbert
The Intentional Stance	Daniel Dennett
The Kingdom of Auschwitz: 1940-1945	Otto Freidrich
The Koran	NJ Dawood
The Large, the Small and the Human Mind	Roger Penrose
The Last Word	Thomas Nagel
The Life of Samuel Johnson	James Boswell
The Life You Can Save	Peter Singer
The Man Who Mistook His Wife For A Hat	Oliver Sacks
The Mental and the Physical: The Essay and a Postscript	Herbert Feigl
The Mind's I	Douglas Hofstadter
The Mysterious Flame	Colin McGinn
The Mysterious Universe	James Jeans
The Nature of Consciousness	Ned Block
The Nature of Explanation	KJW Craik
The Nature of Mind	David Rosenthal
The Nonsense of Free Will	R. T. Oerton
The Noonday Demon	Andrew Solomon
The Open Society and Its Enemies, Vol. 1	Karl Popper
The Oxford Companion to the Body	Colin Blakemore
The Oxford Companion to the Mind	Richard L. Gregory
The Periodic Table	Primo Levi
The Portable Nietzsche	Walter Kaufmann
The Presentation of Self in Everyday Life	Erving Goffman
The Primacy of Perception	Maurice Merleau-Ponty
The Principles of Psychology	William James
The Problems of Philosophy	Bertrand Russell
The Professor and the Madman	Simon Winchester
The Psychopath Inside	James Fallon
The Quotable Hitchens	Windsor Mann
The Rediscovery of the Mind	John Searle
The Religion of Jesus the Jew	Geza Vermes
The Road to Martyrs' Square	Anne Marie Oliver
The Science of Evil	Simon Baron Cohen
The Selfish Gene	Richard Dawkins
The Significance of Philosophical Scepticism	Barry Stroud
The Skeptic Way	Benson Mates
The Structure of Scientific Revolutions	Thomas Kuhn
The Suicide of Reason	Lee Harris
The Symposium	Plato
The Unfinished Twentieth Century	Jonathan Schell
The User Illusion	Tor Norretranders
The Year of Magical Thinking	Joan Didion
Thinking and Deciding	Jonathan Baron
This Republic of Suffering	Drew Gilpin Faust
Three Cups of Deficit	Jon Krakauer
Three Roads To Quantum Gravity	Lee Smolin
Tractatus Logico-Philosophicus	Ludwig Wittgenstein
True Hallucinations	Terence McKenna
Under the Banner of Heaven	Jon Krakauer
Utilitarianism	JS Mill
WAR	Sebastian Junger
What Is Life?	Erwin Schrodinger
What Is Man? And Other Essays	Mark Twain
What's God Got to Do with It?	Tim Page
When the Air Hits Your Brain	Frank T. Vertosick Jr.
When Time Shall Be No More	Paul Boyer
Where Is Science Going? 	Max Planck
While Europe Slept	Bruce Bawer
Who’s In Charge? Free Will and the Science of the Brain	Michael Gazzaniga
Why Darwin Matters	Michael Shermer
Why I Am Not a Christian and Other Essays on Religion and Related Subjects	Bertrand Russell
Why I Am Not a Muslim	Ibn Warraq
Why Orwell Matters	Christopher Hitchens
Without Conscience	Robert D. Hare
Writings on an Ethical Life	Peter Singer
You Are Not a Gadget: A Manifesto	Jaron Lanier
Zen at War	Brian Victoria
Does Santa Exist? A Philosophical Investigation	Eric Kaplan
Good Without God: What a Billion Nonreligious People Do Believe	Greg Epstein
How Nature Works: The Science of Self-Organized Criticality	Per Bak
Incognito: The Secret Lives of the Brain	David Eagleman
Intuition Pumps and Other Tools for Thinking	Daniel Dennett
Knocking on Heaven’s Door: How Physics and Scientific Thinking Illuminate the Universe and the Modern World	Lisa Randall
Life’s Ratchet: How Molecular Machines Extract Order from Chaos	Peter Hoffman
Mistakes Were Made	Carol Tavris
Moral Tribes: Emotion, Reason, and the Gap Between Us and Them	Joshua Greene
Physicalism and Its Discontents	Carl Gillett
Predictably Irrational: The Hidden Forces that Shape Our Decisions	Dan Ariely
Quantum Computing Since Democritus	Scott Aaronson
Self Comes to Mind: Constructing the Conscious Brain	Antonio Damasio
Spooky Action at a Distance: The Phenomenon That Reimagines Space and Time–and What It Means for Black Holes, the Big Bang, and Theories of Everything	George Musser
The Atheist’s Guide to Reality: Enjoying Life Without Illusions	Alexander Rosenberg
The Call of Character: Living a Life Worth Living	Mari Ruti
The Character of Physical Law	Richard Feynman
The Demon-Haunted World: Science as a Candle in the Dark	Carl Sagan
The Ethical Project	Philip Kitcher
The Fabric of Reality: The Science of Parallel Universes and Its Implications	David Deutsch
The Fabric of the Cosmos: Space, Time, and the Texture of Reality	Brian Greene
The Grand Design	Stephen Hawking
The Meaning of Human Existence	EO Wilson
The Shadow of Consciousness	Peter Hankins
The Signal and the Noise: Why So Many Predictions Fail	Nate Silver
Time and Chance	David Albert
To Explain the World: The Discovery of Modern Science	Steven Weinberg
Touching a Nerve: The Self as Brain	Patricia Churchland
Trespassing on Einstein’s Lawn: A Father, a Daughter, the Meaning of Nothing, and the Beginning of Everything	Amanda Gefter
Who’s In Charge? Free Will and the Science of the Brain	Michael Gazzaniga
Why Does the World Exist	Jim Holt
Why Information Grows: The Evolution of Order, from Atoms to Economies	Cesar Hidalgo
Your Inner Fish: A Journey into the 3	Neil Shubin
Do the Work	Steve Pressfield
Finite and Infinite Games	James Carse
See You at the Top	Zig Ziglar
The Republic of Tea	Mel Ziegler
Iliad	Homer
Meditations	Marcus Aurelius
The Book of Laughter and Forgetting	Milan Kundera
The Discovery of India	Jawaharlal Nehru
The Mahabharata	Vyasa
Huckleberry Finn	Mark Twain
One, Two, Three ... Infinity	George Gamow
Problems in Philosophy	Colin McGinn
Professor Romeo	Ann Bernays
The Careful Writer	Theodore Bernstein
The Family Tree 	Carole Cadwalladr
The Last Word	Thomas Nagel
The Mind-Body Problem	Rebecca Goldstein
The Nurture Assumption	Judith Rich Harris
The Selfish Gene	Richard Dawkins
The Strategy of Conflict	Thomas Schelling
The Tin Men 	Michael Frayn
Thinks ...	David Lodge
Moby Dick	Herman Melville
On a Piece of Chalk	Thomas Huxley
Philosophical Letters	Francois Voltaire
The Birth and Death of the Sun	George Gamow
The Character of Physical Law	Richard Feynman
The Mysterious Universe	James Jeans
The Selfish Gene	Richard Dawkins
The Whole Shebang	Timothy Ferris
Warped Passages	Lisa Randall
Employees First, Customers Second: Turning Conventional Management Upside Down	Vineet Nayar
Everything Bad is Good For You: How Today’s Popular Culture is Actually Making Us Smarter	Steven Johnson
Extra Lives: Why Video Games Matter	Tom Bissell
Fab: The Coming Revolution on Your Desktop	Neil Gershenfeld
Fast Future: How the Millennial Generation is Shaping the World	David Burstein
Fooled by Randomness: The Hidden Role of Change in Life and in the Markets	Nassim Taleb
For the Win: How Game Thinking Can Revolutionize Your Business	Kevin Werbach
How to Create a Mind: The Secret of Human Thought Revealed	Ray Kurzweil
Knowledge and Power: The Information Theory of Capitalism and How it is Revolutionizing Our World	George Gilder
Lords of Strategy: The Secret History of the New Corporate World	Walter Kiechel
Makers: The New Industrial Revolution	Chris Anderson
Nanotechnology for Dummies	Earl Boysen
Open Services Innovation: Rethinking Your Business to Grow and Compete in a New Era	Henry Chesbrough
Predictive Analytics: The Power to Predict Who Will Click, Buy, Lie, or Die	Eric Siegel
Present Shock: When Everything Happens Now	Douglas Rushkoff
Quiet: The Power of Introverts in a World That Can’t Stop Talking	Susan Cain
Reality is Broken: Why Games Make Us Better and How They Can Change the World	Jane McGonigal
Rewire: Digital Cosmopolitans in the Age of Connection	Ethan Zuckerman
Robot Futures	Ellah Reza Bourbakhsh
Social Business By Design: Transformative Social Media Strategies for the Connected Company	Dion Hinchcliffe
The Future Arrived Yesterday: The Rise of the Protean Corporation and What It Means for You	Michael Malone
The Lean Startup: How Today’s Entrepreneurs Use Continuous Innovation to Create Radically Successful Businesses	Eric Ries
The Org: The Underlying Logic of the Office	Ray Fisman
The Power of Co-Creation: Build it With Them to Boost Growth, Productivity, and Profits	Venkat Ramaswamy
The Rise of the Creative Class	Richard Florida
The Shareholder Value Myth: How Putting Shareholders First Harms Investors, Corporations, and the Public	Lynn Stout
The Signal and the Noise: Why So Many Predictions Fail	Nate Silver
Tubes: A Journey to the Center of the Internet	Andrew Blum
Wait: The Art and Science of Delay	Frank Partnoy
Wired for War: The Robotics Revolution and Conflict in the Twenty-first Century	P.W. Singer
You Are Not a Gadget: A Manifesto	Jaron Lanier
Good-Bye to All That	Robert Graves
Seven Pillars of Wisdom	TE Lawrence
Testament of Youth	Vera Brittain
Three Day Road	Joseph Boyden